type,id,title,text,created,parent_id
post,iqqtux3,,"Sweet glad we're on the same page about reddit voting 😸

If I was to limit successor PM powers on resignation, I don't think we'd need to change all that much honestly. It wouldn't require a voting reform, it would just pose the incentive for prime ministers to truly own the years they take office for the duration of their term, and should they not, the power must be reaffirmed in the party's new leader. For sure it would increase the frequency of elections during bad governments, but it's far more democratic than the current blank cheque the tories have had since 2015. 

I agree that government mandates are fluid, but I think you perceived a lot more rigidity in this than there really was. Its merely limiting successor unelected ministers' powers until a new election result. The limits would of course be subject to the current affairs of the day, but I think a heavily symbolic one would be limiting the powers the prime minister has over the crown. Anything significant, as you say, would be cleared up by the next election anyway. But such a symbol would finally put a ceiling over Downing Street, however symbolic it is.",10/2/22 16:04,xte9ca
comment,xshssi,Liz Truss admits disruption after tax cut pledges,,10/1/22 3:56,
comment,iqlgz8x,,"Isn't this what they said about austerities when they first came into power? It was supposed to be a temporary measure to get the country back on track from ""Labour's irresponsible spending"". 

The whole time they've been in power they've been making excuses after excuses on why the austerities are needed to keep the country afloat, all while they kept on giving the super rich tax cuts, giving their friends overinflated tax-funded contracts, while cutting funding on important shit like the NHS and police.

At this point anyone who's not super rich who votes conservative is a fucking idiot. We're turning into America, idiots are voting against their own self interests because they focus on pointless populist shit instead of focussing on their own basic needs.

If we were still in the EU, we wouldn't have to pay the crazy bills we're paying today. Fucking EDF, a French company, raised our bills by nearly 60% in April. Do you know how much they raised it in France? 4%. The EU stops them from raising it any higher. We're literally paying double/triple our usual bills to companies that are making record profits because we have a government that allows them to do so.

But nooo, we don't want immigrants - even though this, the same government that promised to put a stop to immigration, has resulted in a crazy influx of illegal immigrants. To rub salt to the wound, they're now relaxing immigration laws to attract more legal immigrants because the same fucking idiots who kept on complaining about ""they're taking our jobs"" don't want to do the supposedly menial jobs that immigrants want to do.",10/1/22 9:22,xshssi
comment,iqklack,,White Star Line admits disruption in Titanic service,10/1/22 4:03,xshssi
comment,iqknmx1,,"Simon Clarke: ""I think it is important that we look at a state which is extremely   
large, and look at how we can make sure that it is in full alignment   
with a lower tax economy."" 

So there it is. If you know you're going to lose the next election anyway, why not crash the economy to give a pretext for drastically reducing the size of the state, making it easier for your mates/donors to conduct business with minimal oversight, and harder for the incoming government to operate.",10/1/22 4:23,xshssi
comment,iqklv00,,"The Office for Budget Responsibility was not asked for their opinion. With such a widespread reaction the last thing Conservatives wanted was one more opinion saying the proposal announced so far is madness. Hard to see how this ""plan"" can be turned into something sensible",10/1/22 4:08,xshssi
comment,iqkmbxq,,~~after~~ caused by,10/1/22 4:12,xshssi
comment,iqkxx18,,It's a feature not a glitch!,10/1/22 5:53,xshssi
comment,iqkl31l,,"I mean, at least...",10/1/22 4:01,xshssi
comment,iqldf7m,,Big of her 🙄,10/1/22 8:37,xshssi
comment,iqnyait,,"Do you want your tax dollars going to help society? Or do you want them in a rich guy's pocket?

Because Liz Truss is dumping tax dollars into rich guy's pockets.",10/1/22 23:14,xshssi
comment,iqo2w6n,,Brits must be the most gullible people in the world. First Brexit and now ‘trickle down economy’. Seriously?,10/1/22 23:47,xshssi
comment,iqokq15,,"Who would have guessed that the time honoured Tory policy of Make the rich richer and fuck the poor would be disasterous in a cost of living crisis.

Its a mystery.",10/2/22 2:01,xshssi
comment,iqlou0h,,As an American I support this message.  People love to vote against their own self interest. Then they blame the consequences of their actions on someone that doesn't look like them.,10/1/22 11:13,xshssi
comment,iqkofis,,It's like they only know one tune.,10/1/22 4:30,xshssi
post,iqlbmjo,,The S&P rating applies to the economy and the government.,10/1/22 8:15,xshssi
post,xr5ch2,"Tax cuts are right plan for economy, says Liz Truss",,9/29/22 14:29,
comment,xoqsc8,"Letters of no confidence in Liz Truss 'already being put in', says Tory MP",,9/26/22 21:02,
comment,iq007p7,,"The current run of Tory leadership has been so volatile.

Cameron => May => Boris => Truss => Who's next?",9/26/22 21:05,xoqsc8
comment,iq08d8r,,"The key thing to remember here, is that the people who know her best, the people she works with every day, her own parliamentary colleagues, those who are most acutely able to see and observe her skillset, voted for Rishi Sunak. 

It was the party membership who bought in to her Margaret Thatcher tribute act, and even then, she didn't get the level of support they were indicating that they thought she would.",9/26/22 21:57,xoqsc8
comment,iq05d9g,,"""Kwarteng also took the opportunity to cut taxes for the highest earners, telling MPs that the 45% higher rate of income tax will be “abolished”.

And he did away with a planned increase in corporation tax from 19% to 25%.

Treasury estimates put the overall measures as costing nearly £45 billion a year by 2026.

Analysis of Kwarteng's fiscal statement by Resolution Foundation said “only the very richest households in Britain” will see their incomes grow as a result of the most significant tax cuts in 50 years.

The richest 5% will see their incomes grow by 2% next year (2023-24), while the other 95% of the population will get poorer.""",9/26/22 21:38,xoqsc8
comment,iq00xxt,,"<Tories> Boris was ""the best for the job"" we had but he's bloody awful so we're kicking him out.<Tories> Months of inside campaigning later we chose the best of what is left but they're bloody awful so we're kicking them out.

<Everyone else> Just give us a general election for fuck sake.",9/26/22 21:09,xoqsc8
comment,iq04390,,"Fuck it, make the next PM Michael Fabricant.",9/26/22 21:29,xoqsc8
comment,iq04cyb,,I wouldn't have confidence in Truss being able to make a cup of tea.,9/26/22 21:31,xoqsc8
comment,iq1154j,,"I am unsure what the heck the thinking is behind this policy. 

Are they desperately trying to do a Trump/Reagan tax cut to have a superficial bump in economic activity that can give them general election victory before the economic reality of this crisis makes itself truly felt?

Or are they trying to commit economic vandalism and give Labour a hospital pass so that even when the Tories lose the next general election, Labour will have such a mess to deal with that Tories might get back in after one term of a Labour government?

Or are these Tories genuinely so stupid that they actually think this is good policy?

It would honestly make about as much sense if Liz Truss secretly was a full blown Marxist and was trying to create the economic conditions necessary to trigger a popular overthrow of the system.",9/27/22 1:04,xoqsc8
comment,iq00i7q,,"Some Conservative MPs have already sent letters of no-confidence in Liz Truss’s leadership over fears she will “crash the economy”, a former minister has claimed.

Top economists, currency markets, opposition parties and some Tory MPs have reacted with dismay to the prime minister and chancellor Kwasi Kwarteng’s borrowing-fuelled tax cut spree.


An ex-minister in Boris Johnson’s government told Sky News that the letters which could trigger a confidence have already been sent to 1922 Committee chair Sir Graham Brady.

“Liz is f*****. She is taking on markets and the Bank of England,” the MP told the broadcaster, saying she and Treasury ministers were “playing A-level economics with people’s lives.""",9/26/22 21:06,xoqsc8
comment,iq0p4t4,,"Gets sworn in, kills the monarch, leaves.",9/26/22 23:44,xoqsc8
comment,iq09n8y,,"""Don't you think she looks tired?""",9/26/22 22:05,xoqsc8
comment,iq03fx2,,"If she crashes the economy would that be the ""big reset"" the tin foil hat brigade were going on about?",9/26/22 21:25,xoqsc8
comment,iq179hb,,"UK, you alright over there?",9/27/22 1:49,xoqsc8
comment,iq1bs5o,,She's speedrunning getting sacked lmao,9/27/22 2:23,xoqsc8
comment,iq17qo3,,"She said the quiet parts out loud, screaming in fact.",9/27/22 1:52,xoqsc8
comment,iq2eull,,"You guys in the UK have some Prime Minister there, such that MPs are gunning for her removal after only three weeks. Frankly, it's rather justified; tax cuts at this point and economic climate are absolutely deranged (not even to mention that they were mostly for the already wealthy, and so profoundly unjust), increasing banker's bonuses is nothing more than an obvious reward for their wealthy constituents, and her legalization of fracking demonstrates a complete failure to understand both that we are in a planetary crisis, which further fossil fuel extraction will only make it worse, and that the only way towards real energy security is in massive expansion of renewable energy. Unfortunately, if indeed she is booted, she'll probably be replaced with another of her breed, maybe even Boris Johnson again. You Brits really need to go all in on Labour during the next general election, whenever that happens. I was reading their pitch a few days ago, and it honestly sounded pretty good to me; some of it was definitely hype, but they actually seem to have a vision to make the UK a better place for everyone, rather than a trickle-down economics hell-hole which serves the rich only, and condemns everyone else to suffer.",9/27/22 7:34,xoqsc8
comment,iq0zvqt,,You guys have been on a steady decline since Brexit was a thing.,9/27/22 0:55,xoqsc8
comment,iq1d1d3,,"If that's true, I'm sure within 6 months the Torries are going to present an equally competent and incorruptible alternative.",9/27/22 2:32,xoqsc8
comment,iq2v8de,,"So is that the new strategy? Introduce new schmuck, new schmuck fucks the UK even further, vote new schmuck out, rinse and repeat?",9/27/22 11:00,xoqsc8
comment,iq3992f,,"It was obvious Sunak was the safer pair of hands. In fact, May has been the best of the bad lot who have followed on from the disastrous David Cameron.",9/27/22 14:14,xoqsc8
comment,iq3c30u,,If its true it needs to be a general election not another Conservative,9/27/22 14:44,xoqsc8
comment,iq1jznt,,"Just give us another general election early, they’ve been through four Prime Ministers in three years, they’ve clearly not got their shit together. If the siphoning of public services, mistreatment of the poor and mishandling of foreign relations wasn’t enough of an indication.

Not to mention their Brexit cock up and lies of course.",9/27/22 3:25,xoqsc8
comment,iq17lrc,,"dear brits, maybe don't vote for a train wreck of a political party next time, and tell your friends and family to do the same, and have them tell their friends and family to do the same.

apply recursion as necessary.",9/27/22 1:51,xoqsc8
comment,iq1jfds,,"Just quit the party. Vote for a non-Tory PM, skip the Tory leadership contests.",9/27/22 3:21,xoqsc8
comment,iq1ct88,,"Jesus, that was quick.",9/27/22 2:30,xoqsc8
comment,iq1j444,,Again?,9/27/22 3:18,xoqsc8
comment,iq1apq8,,If it's being reported by sky news then we can safely disregard any information being presented. It means they couldn't get a credible news source to listen and present the information.,9/27/22 2:14,xoqsc8
comment,iq2efmy,,Interesting how you brits have no direct say in who gets to be PM.,9/27/22 7:30,xoqsc8
comment,iq039b6,,"*""Who?""*

-person receiving letter",9/26/22 21:24,xoqsc8
comment,iq1zp5h,,In all fairness the rich are the ones who generate the money for the economy so less pressure on them means they can expand business. No point in cutting tax for the person who only works 16 hours per week. They barely contribute as it is.,9/27/22 5:23,xoqsc8
comment,iq0aeku,,Opportunists. Meaningless.,9/26/22 22:10,xoqsc8
comment,iq2mjsd,,"Lasted a whole 15 min. That's got to be a record, she wasn't in long enough to change her socks! Wth?...actually I think we're done, pack it up this shit show of a planet is over.",9/27/22 9:02,xoqsc8
comment,iq2r4r9,,Crashing this economy... with no survivors!,9/27/22 10:01,xoqsc8
comment,iq3436m,,"Speed run....

But yeh its an odd turn of events when the banks give the government bolocking rather than the other way round...",9/27/22 13:11,xoqsc8
comment,iq35meo,,echo.......echo.......echo........,9/27/22 13:31,xoqsc8
comment,iq3cwzs,,"The economy may be sinking, but dont worry. The rich have made it to the lifeboats.",9/27/22 14:52,xoqsc8
comment,iq40ez0,,Where's the gif? You limey trolls are missing a fine opportunity to post the pork markets grin.,9/27/22 17:59,xoqsc8
comment,iq43an0,,I don't even like LT or KK tbh to self rightness and up their own behinds tbh....... seriously look after the rich and screw the others .....,9/27/22 18:18,xoqsc8
comment,iq020im,,Boris again. I bet he was the first to send his letter.,9/26/22 21:16,xoqsc8
comment,iq1ezc3,,"American here. How have these dipshits been in power for so long? 

I know your Labour Party is dysfunctional but that lineup of morons you posted is remarkable.",9/27/22 2:47,xoqsc8
comment,iq01kf7,,Conservative belief tends to attract certain... kinds of people....,9/26/22 21:13,xoqsc8
comment,iq00l3a,,Jacob Rees Mogg prob,9/26/22 21:07,xoqsc8
comment,iq092p3,,Piers Morgan,9/26/22 22:02,xoqsc8
comment,iq2ygil,,Will Labour ever get another go in the driver's seat?,9/27/22 11:49,xoqsc8
comment,iq0ob3a,,"Fabricant Surge.

We all need a cosplay Boris.",9/26/22 23:39,xoqsc8
comment,iq175jl,,Michael Gove?,9/27/22 1:48,xoqsc8
comment,iq3wia2,,Mr. Blobby,9/27/22 17:32,xoqsc8
comment,iq5b47n,,A leaning stick of shit.,9/27/22 23:01,xoqsc8
comment,iqkr9qi,,They should require a new election if the PM resigns.,10/1/22 4:54,xoqsc8
comment,iq1c830,,"The key thing to remember, is that they should have called a general right away because sunak was also proposing shit and pandering to the right wing  and rich party members just like truss was.

I almost feel bad for the Tory party members because they had a trolley problem with 1000 on one track and 1200 on the other... But then I remember they are still Tories so they must get off on it.",9/27/22 2:26,xoqsc8
comment,iq3fbev,,"When the first act as leader of a nation in economic peril is to give a tax break to the rich and then blame the banks, it sets the bar pretty low for how invested she is in improving the lives of average citizens.",9/27/22 15:15,xoqsc8
comment,iq1blkc,,"See?  Cutting taxes for the rich.  No time wasted, mind you.

I'm sitting here in America.  Where have I heard this before?",9/27/22 2:21,xoqsc8
comment,iq0aam1,,I'm sure those 2% will trickle down.,9/26/22 22:09,xoqsc8
comment,iq1hqxf,,It isn’t a cost to not steal as much in taxes. It’s a cost to continue to have as much state as possible on available amounts of stolen funds (taxes).,9/27/22 3:08,xoqsc8
comment,iq019io,,"And who do they blame it on? ""The last Labour Government."" Or big bad Brussels. And it does wash with a large chunk of the public unfortunately.",9/26/22 21:11,xoqsc8
comment,iq16mba,,"That's the stupidest part of the system we have in place - it's Tory MPs that get to put in VONCs against their leader to trigger a votebut it's the Tory *membership* who get to vote in the new one. 

Tory membership were fine with Boris, but didn't want Sunak, so ended up with Truss as a compromise.

MPs were not OK with Boris, wanted Sunak, didn't want Truss, but ended up with Truss. 

Like you say - give us a fucking GE.",9/27/22 1:44,xoqsc8
comment,iq1ioro,,"""it cant get any worse than this, oh fuck"" seems to be the motto for the Tories.",9/27/22 3:15,xoqsc8
comment,iq1ivvy,,"<Everybody else> So we can vote Tory again

🤦‍♂️",9/27/22 3:17,xoqsc8
comment,iq04hbx,,The cat on Fabricant's head maybe,9/26/22 21:32,xoqsc8
comment,iq11xbr,,That would mean the Tories have a gay PM before Labour. They already crow enough about having three female leaders.,9/27/22 1:10,xoqsc8
comment,iq0mmqk,,THE MOST BRITISH OF BURNSSSSSSS,9/26/22 23:28,xoqsc8
comment,iq1xt2y,,"I'm guessing you're British and already know this, so this is mostly for other readers.

Here's my view. Truss knows the next election is unsalvageable because:

* Brexit fanaticism has killed any chance of Tories facilitating business with their largest customer, the EU.
* Her own rhetoric paralyzes her ability to cut a deal with them because she has to keep pretending Britain holds all the cards and is putting the screws on the EU who will cave any day now. Every conservative voter is demanding the Tories cut a deal with the EU for the specific regulation that affects themselves while telling the EU to fuck off on any regulation that affects literally anyone else, including other conservative voters.
* They can't plausibly blame the EU for Tory failings any more because they aren't part of the EU any more. And they can't plausibly blame Labour either because the last Labour government was over a decade ago. Not that this stops the Tories from trying to blame them anyway.
* Since the entire damn Brexit thing was to stop EU immigrants and there's a massive shortage of unskilled labor, the Tories have increased the number of immigrants from India and other Third Word countries. But Tory voters hate Indian immigrants even more than EU immigrants.
* Brexit and Tory mismanagement in general has gutted the safeguards for the common man so hard that even conservative voters can't put up with it just to spite the libs.
* There's a massive housing crisis which the Tories have shown no interest in resolving because it would hurt the pockets of their favorite donors.
* The ongoing Ukraine crisis has fucked the economy even harder so a bad situation has become close to apocalyptic.
* Boris' partying while the rest of the country was in lockdown is still fresh in people's minds. This one believe it or not is the reason the Tory voters kicked him out, *not the rest of this fuckery*.
* Labour is leading polls by 8 percentage points (40% intend to vote Labour vs 32% Tories - this means 20% more people intend to vote Labour than Tories). Even Tory die-hards are planning to sit the next election out.
* Keir Starmer is much less easy a target than Jeremy Corbyn and so far all the Murdoch efforts to rubbish his image have failed.
* Tory leadership and Murdoch are probably thinking Labour getting in for a term isn't so bad since they can blame everything on them again. Watch as suddenly all the problems with Brexit will be Labour's fault. ""Brexit would have been nothing but sunny uplands except for remoaner Labour sabotaging everything!""

Hence she is nicking every penny she can for her mates by slashing taxes and borrowing buckets of cash. This has the side effect of making things even harder for the incoming Labour government which the Tories can blame them for.",9/27/22 5:08,xoqsc8
comment,iq1g8e7,,You forgot another option: They are doing this to make the rich richer.,9/27/22 2:56,xoqsc8
comment,iq27240,,">Are they desperately trying to do a Trump/Reagan tax cut

I think they're trying to do the tax cut right away because they may not fair well in the next election? Just hypothesis.

Notice when Trump got elected, one of the first things they did was do the massive tax cuts. It was their priority. So being these people seem to be cut from the same cloth (greedy as fuck), it would make sense.",9/27/22 6:21,xoqsc8
comment,iq1e5ak,,">Or are these Tories genuinely so stupid that they actually think this is good policy?

Ding, ding. New winnah.",9/27/22 2:41,xoqsc8
comment,iq0uoj4,,The best thing is you can see their economic plan in advance by reading their book Britannia Unchained. None of this should have been surprising.,9/27/22 0:20,xoqsc8
comment,iq1e823,,"Take my upvote, clever boy.",9/27/22 2:41,xoqsc8
comment,iq070bi,,"Do you not expect a crash? If it crashes, are the tinfoils still wrong?",9/26/22 21:48,xoqsc8
comment,iq19aji,,We need turning off and back on again.,9/27/22 2:04,xoqsc8
comment,iq1c6yb,,They're just busy cutting taxes for the very rich.  Don't worry about 'em.,9/27/22 2:26,xoqsc8
comment,iq1pfrw,,"We warned the voters, but we were told it was project fear. Looks like we were right and they were wrong.",9/27/22 4:06,xoqsc8
comment,iq0vi99,,She's been funneling money to the ultra rich and gouging the poor.,9/27/22 0:25,xoqsc8
comment,iq0ihn2,,"Fuck, I wouldn't even be mad if this was some elaborate plot by him. That would be hilarious 5D chess.",9/26/22 23:02,xoqsc8
comment,iq07wzf,,"nah ... given his bloviated prose, he'd still be writing it",9/26/22 21:54,xoqsc8
comment,iq1u7ku,,Your last line basically sums it up. The Tories haven’t won elections as much as Labour has lost them.,9/27/22 4:41,xoqsc8
comment,iq2onco,,None of the above have seen out a single term. Cameron should have been in until 2020.,9/27/22 9:28,xoqsc8
comment,iq2vi8h,,"First past the post. Even if a party gets a lot of overall votes, if they are not condensed your vote is ignored and changed to the party that got the most in your area.

This has resulted in a lot of voter disenfranchisement as people don't feel represented and think their votes don't count. 

And so whenever Labour make a mistake it becomes harder and harder for them to win just on the grounds of them not being the Conservatives as less people want to vote in general due to being scorned by an outdated voting system.",9/27/22 11:04,xoqsc8
comment,iq2xn1j,,"Because they've realised that if they all out the other guy when things start to go south, replace them with someone less competent, and then replace them with someone more competent again, it wipes the slate clean.

They never intended for Truss to stay long, but I think they also seriously underestimated her incompetence.",9/27/22 11:36,xoqsc8
comment,iq2ugfj,,"Because - just like your GOP - the one thing they are good at is falling in line.

Labour, not so much.",9/27/22 10:49,xoqsc8
comment,iq2qwdq,,"Speaking to people running up to the elections it felt to me that those I spoke with didn't like either party or their policies so they did a ""rebellious"" vote for a party they knew really didn't have a hope in hell, beyond stupid if you ask me.",9/27/22 9:58,xoqsc8
comment,iq1vb5p,,Until recently labor had bigger morons. Feel bad for the UK.,9/27/22 4:50,xoqsc8
comment,iq0wfi0,,"Surely he'd be a shoe in for Prees Moggister, a new title and low in British history",9/27/22 0:31,xoqsc8
comment,iq1gymj,,"Mate in your analogy most of them Tory party members were probably only bummed that there was no way to hit all 2,200 on the tracks.

I know, I know, 'Tory bad lol' - but I kind of think you have to be at least reasonably malicious to still vote Tory after the last few years...",9/27/22 3:02,xoqsc8
comment,iq1pdls,,Give me some of that A-mazin' trickle!,9/27/22 4:05,xoqsc8
comment,iq0rlv5,,Except even the 2% will be wiped out by the fall in the pound.,9/26/22 23:59,xoqsc8
comment,iq1qsq3,,"If taxes are theft how do you propose funding services like police, fire services, the military, etc.?",9/27/22 4:16,xoqsc8
comment,iq1x1hj,,"You think taxes are theft, but I bet dollars to donuts (pounds to peanuts?) that you think profits aren't.",9/27/22 5:03,xoqsc8
comment,iq1djkt,,Who was the last Labour PM anyway? Brown? And wasn't that 10 years ago?,9/27/22 2:36,xoqsc8
comment,iq032v2,,Monster raving narcissist party.,9/26/22 21:23,xoqsc8
comment,iq0byog,,Porque no los dos?,9/26/22 22:20,xoqsc8
comment,iq17uwn,,"MPs didnt want Sunak. Two reasons: one he is a very bad candidate, second they are racist so they wont vote for an Indian.",9/27/22 1:53,xoqsc8
comment,iq18r14,,"It's a cack-handed democratisation of the parties that has led to this weird set of incentives in party leadership elections. Historically they just did an internal ballot of MPs (only formally since 1965 for the Tories, 1920s for Labour) since each of them has their own mandate and they're who a would-be PM will rely on to keep their government together.

It seems like a system that's doomed to produce leadership at odds with its MPs, polarisation between the parties, and an overall more dysfunctional system - in the name of giving a tiny fraction of the electorate more of a say over who leads the country.",9/27/22 2:00,xoqsc8
comment,iq07191,,The official cat at Number 10 always struck me as the must trustworthy of the bunch.,9/26/22 21:48,xoqsc8
comment,iq34eyq,,"I was just thinkin, even if Labor came in *tomorrow* and raised taxes to balance the budget.... 

They'd just get attacked for raising taxes.... especially if the economic shit storm is still there afterwards",9/27/22 13:15,xoqsc8
