type,id,title,text,created,parent_id
comment,is46534,,"It's called a parliamentary democracy. The people vote for the party, not the leader. It allows the party to remove the leader at any time mid term if they do a shit job, as recently demonstrated with Boris. This limits the individual power of any government leader, who is representing their party and is constantly answerable to them.

Of course there's an argument that any time the party chooses a different leader, and election should be called. But that would disincentivise the party from removing a leader. It's imperfect, but it mostly works. Which is partly why the UK is home to the worlds oldest continuous democracy.",10/13/22 7:11,y21z0y
comment,is0pkwl,,I doubt she will be Tory leader by the time the election comes round.,10/12/22 16:37,y21z0y
comment,is0j9h4,,We dont elect the prime minister we elect the party.,10/12/22 15:46,y21z0y
comment,is0on97,,"No.  The Prime Minister is the head of the party with the majority in Parliament.  Consider the equivalent in the US system as being if there was no President, instead Nancy Pelosi or Chuck Schumer was head of the government.   


The last round of elections was 2019, and unless Parliament calls for an early round of elections (which they can do), the next will be in 2025.   


Liz Truss is new to all of this not because of a new election but because Boris Johnson stepped down from the role as head of the Conservative Party and thus the Prime Minister position.  Truss was chosen by the Tories, currently in power, as the next leader of the party and thus, the Prime Minister.",10/12/22 16:30,y21z0y
comment,is0jkxn,,"No. She was elected party leader by party members but since the Conservative party is in government, it also means she became Prime Minister too.",10/12/22 15:49,y21z0y
comment,is12wmp,,we NEVER elect prime ministers it's a fucking joke they have as much power as they do,10/12/22 18:12,y21z0y
comment,is0k1wz,,"No, we didn't elect her. That's the point.",10/12/22 15:53,y21z0y
comment,is48d71,,"Not the same position. In the UK the party in government have spent decades selling themselves as fiscally responsible. But unlike your president, or prime ministers can be removed and replaced at any time by their party.  Now, mid term, without a general election, the party have changed the person at the top, and that person has destroyed the party's own reputation overnight by announcing a package of radical, sweeping financial changes from that have taken everyone (most notably the markets) by surprise.",10/13/22 7:34,y21z0y
comment,is48wpg,,"Because the policies now being introduced by Truss, mid-term, are not in keeping with the manifesto that the party were elected on. In fact they are against the whole ethos of the ""fiscally responsible"" conservative party that she represents.",10/13/22 7:40,y21z0y
comment,is0h4jw,,That was both charmingly British and offensively misogynistic.,10/12/22 15:28,y21z0y
comment,is46r4s,,When did she run against Boris?,10/13/22 7:17,y21z0y
comment,is13sct,,"she has no democratic mandate, she was elected by the tory membership, 1/8th of 1% of the population, her tax plan wiped several billion of the economy, that's within a couple of weeks, and she still thinks that she did the right thing and it's jolly unfair of reality to kick up such a fuss like this, she also went back on her word about 3 times so far.",10/12/22 18:18,y21z0y
comment,is0vuvf,,"She idolises Thatcher? Believes in tax cuts for the rich? Wants to decreases benefits? Wants to allow fracking? Remove cap on bankers bonuses? All within one month? 

I think that’s more than enough damage.",10/12/22 17:23,y21z0y
comment,is0m2fo,,"Look at him eat that bacon sandwich like an amateur, this man is pure evil to be put in power!!! - The typical British voter",10/12/22 16:09,y21z0y
comment,is35biv,,Not just in the UK is this a problem but look across the pond and you will see the same thing in the US.,10/13/22 2:24,y21z0y
comment,is21jqp,,"Musical Shits, what a wonderful game.",10/12/22 21:58,y21z0y
comment,is26ug9,,She almost collapsed the British economy with her first mini budget lol.,10/12/22 22:33,y21z0y
comment,is195nz,,That’s just standard Tory behaviour,10/12/22 18:54,y21z0y
comment,is0ew92,,I’d love to see it happen.,10/12/22 15:07,y21z0y
comment,is1j443,,"Cosplayers only look like their characters, they don't share their power.",10/12/22 19:59,y21z0y
comment,is2gcjr,,"Yes, but it would also have been much better considered in the first place. We might have hated it just as much, but at least its impact wouldn't have been a complete surprise to the people trying to implement it!",10/12/22 23:32,y21z0y
comment,is31qyt,,"This is how the Republicans work over here in the US. They burn the house down in every conceivable way, lose power, then blame the Democrats for everything being destroyed... and then get re-elected, only to burn everything down *yet again*.

Voters having a shorter memory than your average goldfish doesn't help, and continual destruction of public education only ensures that the electorate remains ignorant and susceptible to conservative bullshit. 

It's the Murdoch effect: every Anglophone country has a section of its population that has been thoroughly indoctrinated by right-wing propaganda. The US, UK, Canada, Australia, etc., are all dealing with the effects of the Murdoch machine (and the cockroaches that feast in its wake) feeding xenophobic, racist, bigoted, anti-scientific, anti-democratic bullshit to an audience that is quite literally addicted to outrage. Rupert Murdoch and his family have done more damage to democracy and the world at large than almost anyone out there. He makes Goebbels look like an amateur.",10/13/22 1:57,y21z0y
comment,is3aoun,,"Well that's the point. The Tories are doing *so poorly* that it doesn't matter if Labour and Lib Dems are doing good politically, nobody wants to vote Tory. So they go with the next best thing. Which is Labour or Lib Dem.

And anecdotally, I think Labour are enjoying a bit of a boost after a generally successful labour party conference, and riding the storm that the Tories are producing for them. If they just came out in favour of the unions and the strike action, I reckon they'd be on a winner.",10/13/22 3:04,y21z0y
comment,is0k8r9,,"That's the old ""stiff upper lip"" social programming paying off.",10/12/22 15:54,y21z0y
comment,is0kdej,,"While historically your take is correct, I can only hope this instance becomes the exception that proves the rule lol",10/12/22 15:55,y21z0y
comment,is1xssm,,This is a bit of a generalisation. We have lots of protests in the UK.,10/12/22 21:34,y21z0y
comment,is0t8jx,,"There are almost constant protests around the country these days, they very rarely get much media coverage though.",10/12/22 17:04,y21z0y
comment,is0pt0j,,"Complain over tea and biscuits, personally.",10/12/22 16:39,y21z0y
comment,is25vl8,,">They will sit there and complain behind a computer but won't do anything meaningful to make the government think about their policies.

Half of them will vote Conservative again anyway, and then bitch about it later at the pub.",10/12/22 22:26,y21z0y
comment,is0pzig,,"Ordinarily i would totally agree with you.

But Truss is so bad shes not just burying the working class like a standard Tory.

The Tory voters will also feel the pinch in mortgage rates and other cost rises.

So you never know....",10/12/22 16:40,y21z0y
comment,is1c9ng,,I think you are all nuts for having non-fixed rate mortgages. Absolutely blows my mind.,10/12/22 19:14,y21z0y
comment,is1zcv8,,"Fwiw, it's the conservative party doing this internally with only a touch of the people's voice in the final round of leadership elections.

Still comes across as a beached whale rolling in circles.",10/12/22 21:44,y21z0y
comment,is0ke25,,"We elect the party based on a manifesto.

Whatever Truss's ever-changing manifesto is, we didn't get to vote on it.",10/12/22 15:56,y21z0y
comment,is0jgsz,,"K that's fair so to reiterate seeing as I have no idea how yalls politics work as I'm not from there 

Didn't this person just assume office?",10/12/22 15:48,y21z0y
comment,is138hu,,"Like I said under I have no clue how yalls system works tbh, I just remember boris Johnson getting the boot recently and this lady takin over the office and now they want her gone too

So just confused I don't really care if yall downvote me just asking an honest question",10/12/22 18:14,y21z0y
comment,is4o4tp,,What manifesto pledges is she breaking?,10/13/22 10:50,y21z0y
comment,is13xpt,,Thank you. This reply made the most sense. I truly wasn't aware.,10/12/22 18:19,y21z0y
comment,is11g0j,,Did she do those things or say she wanted to?,10/12/22 18:02,y21z0y
comment,is3rwop,,3 blonde Prime Ministers in a row though.,10/13/22 5:10,y21z0y
comment,is2avw5,,Speed running,10/12/22 22:58,y21z0y
comment,is274jm,,Damn thats quick,10/12/22 22:34,y21z0y
comment,is25nwt,,"That's what everyone said last time.

Didn't happen.",10/12/22 22:25,y21z0y
comment,is0n1hp,,"As a brit, I hope so too. 

There's a lot happening that's not really getting much attention- there have been  pretty big protests in most cities as part of the 'enough is enough ' campaign.  

The tories like to drone on about the energy support,  but it's not even making a dent really.  Prices at the supermarket are up 50% on some essentials.  The same pack of pasta that was 50p 2 weeks ago is now over £1. 

People's mortgages are about to rise significantly, by hundreds of pounds, which offsets any help with energy costs. Rent is going up because buy to let landlords can't pay their  mortgages. 

Railway workers are on strike,  postal workers are on strike,  lots of BT workers are striking,  NHS staff are considering strikes. Teachers are leaving in droves because it's just not worth it. 

When this ends with hungry people,  sitting in the dark due to blackouts, the house of cards will fall down. 

Hopefully this disgraceful bunch of criminals will be out for at least a generation.",10/12/22 16:17,y21z0y
comment,is2721i,,No generalisation. There may be some protests but there's also a huge percentage of people that just sit there crying that the country's crumbling beneath them from behind a screen and wonder why the government is taking advantage of them. It's because the general population are too easy against them which in turn lets the worse policies go by without any real implications for said government.,10/12/22 22:34,y21z0y
comment,is1db4v,,I'm not British. I'm American.  I have a fixed rate mortgage at an ungodly low 3.2%.  I agree that it's absurd that so much of the rest of the world is standardized to variable rate mortgages.,10/12/22 19:21,y21z0y
comment,is1zhz0,,Labour did the same with Gordon Brown replacing Tony Blair in 2007.,10/12/22 21:45,y21z0y
comment,is0kq2t,,I keep expecting to protest. Then we don't. I wonder how bad off we have to be before we say it's enough,10/12/22 15:58,y21z0y
comment,is0obqq,,"In 2019, the British people voted for the Conservative party, based on a hardening of the right wing vote around accomplishing Brexit and a dislike in the population at large for Corbyn, leader of Labour who are the party of opposition. The Conservatives, lead by Boris Johnson, won with a 40%ish vote share to 25%ish, but because of the first past the post system they had a healthy majority in Parliament.

Since then and most notably since the end of Covid restrictions in the UK, the Conservative party have been characterised by sleaze which made them unpopular to the general population. A major turning point where Labour went ahead in the polls was about the Conservatives allegedly breaking their own rules during Covid to host parties. This sleaze culminated in Johnson being forced from office by internal pressure in his party.

As the British people vote for the party, not a single prime minister, the party in government remains in government if they can elect a new leader capable of forming one. The Conservatives’ own system takes a decent while, returning two candidates from within the Parliamentary party that members of the party around the country vote on. In reality, this numbers about 150,000 voters which makes up about 0.25% of the country. The party members are also disproportionately southerners, male, and white. This has grown discontentment as the Prime Minister hasn’t been voted for by 99.75% of the country.

Whilst the election was going on over the summer, Conservative sleaze was accompanied by a cost of living crisis in the UK, particularly energy bills but also food, transportation, and wages. Lots of unions have been striking in the last three or four months, growing discontentment further.

One of the first things Truss and Chancellor Kwasi Kwarteng announced was a mini-budget. The effects in confidence were so profound it crashed the value of the pound compared to the dollar and required unprecedented action by the IMF and the Bank of England. Fiscal responsibility is one of the Conservative party’s major beliefs.

Essentially, the government is wildly unpopular anyway, forces the old prime minister to resign, ignores growing discontentment, effectively appoints a new prime minister, and then the first thing the new prime minister does is a catastrophic failure. The gap between the conservatives and their opposition is now being polled at around 50% for Labour and 20% for the Conservatives. 

There have been rumours already of a vote of no confidence within Parliament and it is clear that the public have no faith in her as Prime Minister. Whilst Parliament is technically bound to five year terms, it is fairly simple to force an election if the majority government wants one - the last two electoral cycles were about two years each. However, Conservative unpopularity means they will do terribly at an election in the near future and as such Truss won’t call one.",10/12/22 16:27,y21z0y
comment,is0jswo,,The tory party elects their leader. They have a series of votes and start with a few and slowly narrow it to 2 then vote on the PM. This is happening a fair bit recently as they play pass the bag of shit that is their policy around in the hope its not them holding the bag when the music stops.,10/12/22 15:51,y21z0y
comment,is2ur51,,"You can think of our PM as similar to your Speaker of the House, but with the executive powers of your president. Your Speaker can change at the will of their party, no elections involved.

If Nancy Pelosi stood down today, the Dems would put forward a new Speaker. Boris Johnson stood down and both Liz Truss and Rishi Sunak were put forward by their colleagues. Regular members of the Conservative party (old white folk) then chose Truss over Sunak (because he's the 'wrong' colour).",10/13/22 1:07,y21z0y
comment,is174ih,,"all the british public get to do is elect a Member of Parliament(MP), it's the party that elects the Prime minister(PM) so in this case Boris was the leader of the tory party in 2019 and his popularity helped some tory candidates win their seats and become MPs but then he got found out and became extremely unpopular and so the party, after a struggle, got rid of him.  the MPs voted on various other MPs to replace him until there were only 2 choices left, Liz Truss and Rishi Sunak, then the full conservative party voted on which one they like the most (unsurprisingly it was the white one) and bingo the rest of the country has this muppet in charge.

The idea of the PM was originally as a sort of 'first amongst equals' thing but they have been aquiring more and more power for almost 300 years, Boris in particular liked to spit on traditional restraints on his power, and they also get all sorts of powers for being the monarch's representative in parliament.",10/12/22 18:40,y21z0y
comment,is4yj1l,,"Others have tried to describe it similar to the U.S one but I feel they fall short. Take your house of representatives and imagine that whoever controls the house gets to elect a leader as president, they could oust the president but because they still control the house they get to elect a new president. That's about as similar an analogy as you're gonna get",10/13/22 13:21,y21z0y
comment,is4stdm,,"The big one is the pledge not to borrow more to fund public spending.

Another one is the pledge not to lift England’s moratorium on fracking.",10/13/22 12:00,y21z0y
comment,is29svm,,Yeah she has like a 10% approval rate lmao,10/12/22 22:51,y21z0y
comment,is261e5,,She’s far less popular than Boris though and she knows it,10/12/22 22:27,y21z0y
comment,is1tnzb,,"They've also imposed their own ""Rwanda Plan"" for asylum seekers, which to me is just a 1:1 to the Nazis ""Madagascar Plan"" to deport their Jews in the 1930s to Madagascar, eventually leading to the final solution once it failed.

As an American, at least we can trust in the good 'ol Brits to follow lockstep in our trends, and currently the trend is very Nazi.",10/12/22 21:07,y21z0y
comment,is5yv7t,,Pretty sure it's the dictionary definition of generalisation to be honest.,10/13/22 18:26,y21z0y
comment,is232qt,,"To be fair we absolutely do have fixed rates. It's just plenty of people for whatever reason don't shop around after the first fixed period ends.

I'm on 1.24% for 5 years, soon as that period is close to being  over I'll be looking around for my next fix.

I take it in the US you guys are more aware about getting a fixed rate than us brits then?",10/12/22 22:08,y21z0y
comment,is2j17u,,,10/12/22 23:49,y21z0y
comment,is262yh,,"True, but he didn't immediately fuck up and set the gears into motion to have a year with 3 PMs, neverminded the full extent of the term so far.",10/12/22 22:28,y21z0y
comment,is47j97,,There doesn't seem to be much sign of organisation yet. I've seen nothing on social media etc announcing organised mass protests by any particular action group. Yet.,10/13/22 7:25,y21z0y
comment,is4upct,,"The report on fracking comes out tomorrow. If it confirms that fracking may go ahead without significant risk then it is not a beach of the manifesto.

I don’t see anything specific about borrowing.",10/13/22 12:28,y21z0y
comment,is26ddy,,"Doesn't matter if she's far less popular than Boris.

All that matters is that the Conservatives are more popular than Labour.",10/12/22 22:30,y21z0y
comment,is26246,,"I don't think anyone will ever be sent to Rwanda.  There's just no way to overcome the legal challenges,  and the tories know it. 

It's just to attract the right wing voters- tories have no intention of reducing immigration.  

I've never spoken to anyone in real life who agrees with the Rwanda plan. It's morally bankrupt.",10/12/22 22:28,y21z0y
comment,is26o0l,,"mine is 4% for the entire life of the loan. If it's only fixed for a limited time, it's not really a fixed rate mortgage.",10/12/22 22:31,y21z0y
comment,is413lo,,Yeah they are basically non-existent after 2008,10/13/22 6:24,y21z0y
comment,is3033b,,I sneer at my own electorate too if that makes you feel better,10/13/22 1:45,y21z0y
comment,is2o9iu,,"As a labour supporter and a pessimist I have to agree as we have been unable to win an election in what feels like forever, but those polls look quite in labour's favour don't you think?",10/13/22 0:23,y21z0y
comment,is2dd50,,That’s marginal atm anyway. But most people vote for the leader not the party as a whole,10/12/22 23:14,y21z0y
comment,is2beo1,,"I mean it is, just a temporary fix rather than permanent. Plus you can then look to fix again.

It has the advantage of being flexible but does mean there is risk to having it go higher too when getting it fixed once more.

Longer you fix for the higher the rate which will be one of the reasons I've been able to get 1.24% vs your 4%",10/12/22 23:01,y21z0y
comment,is2swsy,,">but those polls look quite in labour's favour don't you think?

Sure, and if an election was called tomorrow, they might even win.

Unfortunately, the next election isn't scheduled for another 3 years.

Let's not forget that Labour was ahead in polling prior to the 2015 election, which they lost.  They were on a massive upswing in polling prior to the 2017 election, which they also lost.  They were almost neck-and-neck leading up to the 2019 election, which they also lost.

I'm sure once Truss figures out how to extricate her head from her ass, the polling figures will return to normal, much like the GBP and stock market.",10/13/22 0:54,y21z0y
comment,is2elct,,"In the US, we consider anything that isn’t fixed for the life of the mortgage to be an adjustable rate mortgage. Plenty of people do have ARMs, but those people are either stupid, or else have very poor credit.

Getting an ARM when interest rates are low is a risky proposition.",10/12/22 23:22,y21z0y
comment,is2gm5c,,"Fair enough, yeah, I dont understand why anyone would take the risk with variable rate (what we in the UK call it) if they have a choice. It's one of the things fucking over landlords at the moment causing them to put up rent because so many of them don't bother trying to get theirs fixed. 

Our standard mortgage fix rates are 2 year, 5 year and 10 year I don't think full mortgage length ones are common here, only reason I went 5 year instead of 10 is because the interest rate would have been far far higher and I decided to take the risk.

I feel sorry for the poor buggers whose fixed rates are ending now with how much rates have shot up.",10/12/22 23:34,y21z0y
post,is2qgqz,,"Yeah, in the US we'd call a 5 year fix a 5/1 ARM (meaning an adjustable rate, fixed for the first 5 years, and able to be changed once per year after that).

I definitely agree that getting one that's adjustable right from the start seems like a bad idea, unless you're really sure that rates are historically high right now (and even then, it's a risk, since you could just refinance if rates drop so you're never really ""locked"" into high rates).",10/13/22 0:37,y21z0y
comment,y1z9yl,‘They are stealing Russia’: Adam Curtis on how hyper-capitalism wrecked a nation – and why Liz Truss must take heed | Adam Curtis,,10/12/22 12:29,
comment,is03f76,,"This on BBC from tomorrow - 

https://www.bbc.co.uk/mediacentre/2022/adam-curtis-russia-1985-1999-traumazone",10/12/22 12:53,y1z9yl
comment,is0259s,,"Upon reading that headline my mental image was Truss riding in a bank van saying ""Damn the torpedoes: full speed ahead!""",10/12/22 12:35,y1z9yl
comment,is0vq4d,,>‘They are stealing Russia’: Adam Curtis on how ~~hyper-capitalism~~ oligarchs wrecked a nation – and why Liz Truss must take heed,10/12/22 17:22,y1z9yl
comment,is0534f,,*corruption,10/12/22 13:17,y1z9yl
comment,is0iy6d,,What have happened in Russia is not capitalism. It is just kleptocracy running by real life “super villain”.,10/12/22 15:43,y1z9yl
post,is3csmn,,"“Hyper capitalism”? What happened in Russia was the absence of functioning capitalist markets, not too much of it.",10/13/22 3:20,y1z9yl
comment,y1wx94,Power giants to face windfall tax after all as Liz Truss delivers U-turn,,10/12/22 10:07,
comment,irzsetk,,"not only is she for turning, she's also no lady, all this turmoil in the markets at a time of economic decline and hardship for he poorest sectors of society and all they can do is make it worse by appealing to their base, who wil also lose out, shame on them",10/12/22 10:10,y1wx94
comment,irzsigr,,Put her on a generator and a heat pump and GB will be lit and warm over the next nuclear Winter.,10/12/22 10:12,y1wx94
comment,is03zmp,,"liz truss is a massive gaping cunt

I seriously wonder why the conservative party even elected her 

can't wait for another (unelected) PM change next year \*\*sigh\*\*",10/12/22 13:01,y1wx94
comment,is054bb,,"At this point, she's made so many U-turns I think the adequate phrase should be ""Truss continues to circle the roundabout""",10/12/22 13:17,y1wx94
comment,irzujkj,,"It's a shame that the UK's final Prime Minister had to be someone like her. I guess it's some comfort, though, that that means someone like a Clement Atlee won't likely be at ground zero.",10/12/22 10:41,y1wx94
comment,is0i1ou,,"So, US would be basically the only developed country which would not employ windfall taxes to rain in inflation? Sad.",10/12/22 15:36,y1wx94
comment,is24tbr,,"sorry but what is going on

is this a windmill I am getting dizzy with all those changes and volte faces",10/12/22 22:20,y1wx94
comment,irzue81,,Her blood would freeze the pump in seconds.,10/12/22 10:39,y1wx94
comment,is0027l,,“Final”?,10/12/22 12:04,y1wx94
comment,irzuinp,,The hot air she produces should do the trick and more.,10/12/22 10:41,y1wx94
comment,is007pn,,I'm convinced a global thermonuclear pyrotechnic show is immenent.,10/12/22 12:06,y1wx94
comment,is00gg4,,There’s a surprise,10/12/22 12:10,y1wx94
comment,is048tt,,"people have been convinced of that every day since nukes were made aware to average joe

what's going on in the world is crazy, but craziness happens each year. it's just... people seem to forget the past.

the world will end soon, but not from nukes. I have my money on global warming ending it all over nukes.",10/12/22 13:05,y1wx94
post,is05ucf,,"It'll take over 70 years before the Earth is incapable of supporting multicellular life between the 40-degree latitude lines. And since humanity would have long since been rendered incapable of emitting carbon, the global temperature would halt at 13.2 degrees above 2000's level. Invertebrates would then inherit the Earth. However, when Putin launches his 6,000 nukes, and NATO launch their 6,000 in response, it'll likely spell an end to all multicellular life, especially since at least the former, if not both factions, will ""salt"" a good amount of the warheads with cobalt.",10/12/22 13:26,y1wx94
