type,id,title,text,created,parent_id
post,y87kyp,UK leader Liz Truss loses second minister,,10/19/22 19:41,
comment,isyoxry,,That’s the lovely lady who said her “dream” was to see a plane full of refugees taking off for Rwanda (while she’s herself the daughter of a refugee who fled Kenya for the UK),10/19/22 20:47,y87kyp
comment,isyfy4g,,,10/19/22 19:49,y87kyp
comment,isyg4i7,,Please let this wake the UK up to how inept the Conservative Party is.,10/19/22 19:50,y87kyp
comment,isyg3aa,,What’s the record for shortest PM tenure?,10/19/22 19:50,y87kyp
comment,isyh7na,,"The rats are trying to leave the sinking ship, now all the other ministers are looking for an excuse to leave as well: 

""I can't be the minister of public health anymore, I had pizza for lunch yesterday!"" 

""Yeah I have to leave as well, I think I left the kettle on...""",10/19/22 19:57,y87kyp
comment,isyi9ap,,"Wait, she left voluntarily? I'd figure after the backlash over her comments about Rawandan refugees, she'd have been asked to fall on her sword.",10/19/22 20:04,y87kyp
comment,isynzzj,,Did she check under the bed or behind the dryer?,10/19/22 20:41,y87kyp
comment,isyfy8i,,"Bum bum bum.

Another one bites the dust!",10/19/22 19:49,y87kyp
comment,it0iviv,,"Remember the hullabaloo about how marvelous and diverse this cabinet was? How it was sure to be successful and all that?

Maybe they should have focused on getting the best people for the job in. Of course, that may very well mean that the Conservatives are not well suited. 

I am not fully up on UK politics so cannot speak to the granular details. But, it does seem somewhat odd to see it implode quite so fast.",10/20/22 4:18,y87kyp
comment,isyy2zu,,Oh dear. I hope she can remember where she last put it.,10/19/22 21:47,y87kyp
comment,isztewg,,Not worth making joke tee shirts or funny tea mugs as by the time they hit the shops she will be gone,10/20/22 1:07,y87kyp
comment,it07iwv,,"""Bam! Bitch went down. Super bitch!""",10/20/22 2:53,y87kyp
comment,it0ekba,,Not much of a loss to be fair,10/20/22 3:46,y87kyp
comment,isyeq8w,,"Hi ALife2008. Your submission from scmp.com is behind a metered paywall. A [metered paywall](http://en.wikipedia.org/wiki/Paywall#.22Soft.22_paywalls) allows users to view a specific number of articles before requiring paid subscription. Articles posted to /r/worldnews should be accessible to everyone. While your submission was not removed, it has been flaired and users are discouraged from upvoting it or commenting on it. For more information see our [wiki page on paywalls](/r/worldnews/wiki/paywalls). Please try to find another source. If there is no other news site reporting on the story, contact the moderators.

*I am a bot, and this action was performed automatically. Please [contact the moderators of this subreddit](/message/compose/?to=/r/worldnews) if you have any questions or concerns.*",10/19/22 19:41,y87kyp
comment,it06taq,,Check between the cushions.,10/20/22 2:48,y87kyp
comment,it1g0us,,"""Oops, look at what I did! Oh no now I'm ""forced"" to resign""

Rats fleeing a sinking ship.",10/20/22 9:29,y87kyp
comment,it0glap,,"You have to hand it to the conservative party, they really have an eye for picking out self hating children of immigrants and nurturing that hatred to lunatic proportions.",10/20/22 4:01,y87kyp
comment,it1b8u9,,I found that the Africans I worked with generally don't like other Africans.A fellow from Zimbabwe that I worked with hated South Africa because of all the crime and the bad experiences he had.Another fellow from Ghana generally hated Nigerians and Somalians.,10/20/22 8:28,y87kyp
comment,isypi0h,,"""Three times is enemy action.""
 
- Auric Goldfinger",10/19/22 20:51,y87kyp
comment,iszdzvf,,The Brighton Line!,10/19/22 23:27,y87kyp
comment,it0at0z,,"""To have one minister like that is a mistake, to have three is an insult""

- Alicent Hightower?

..three because in addition to the ministers she just lost the chief whip (which may as well be as important as a minister)",10/20/22 3:18,y87kyp
comment,isyp7up,,"Look at the last 4 pms if they haven’t got the message yet they aren’t going to, I’ve given up all hope that the country wakes up.",10/19/22 20:49,y87kyp
comment,isyuwhz,,I wish every country would look to their cons with a suspicious eye - a Canadian,10/19/22 21:26,y87kyp
comment,it0hc5w,,"This is why I hate being in Northern Ireland sometimes. Every few years we get to watch England basically pick out the worst person possible to lead the whole of the UK. 

The main parties don't even run any candidates in our area so it doesn't matter who the hell we vote for, we're stuck with whoever they decide.

Same with Brexit. We voted against it, but does it matter that two of the four countries in the UK rejected Brexit? Of course not. Dicks.",10/20/22 4:07,y87kyp
comment,it00dfb,,"The last polling data I saw (a week ago?) suggested that if an election were held then, the Tories wouldn't even be opposition. The LDP would. A very small shift could even see the Scots be the opposition party which would be hilarious.",10/20/22 1:58,y87kyp
comment,isyj5t6,,,10/19/22 20:10,y87kyp
comment,isyjtcm,,"[https://en.wikipedia.org/wiki/List\_of\_prime\_ministers\_of\_the\_United\_Kingdom\_by\_length\_of\_tenure](https://en.wikipedia.org/wiki/List_of_prime_ministers_of_the_United_Kingdom_by_length_of_tenure)  


George Canning",10/19/22 20:14,y87kyp
comment,isz4xrk,,"If you don’t count dying, the shortest before being replaced was Goderich in 1827 (ironically right after the shortest serving PM, who died), at 144 days. If you only include post WW2, that goes up to 363 days. Trus still has 101 days to go before even making it to the 144 day mark",10/19/22 22:30,y87kyp
comment,it3dqog,,Truss,10/20/22 20:15,y87kyp
comment,iszmter,,">The rats

Rats that voted for her as Tory leader just 2 months ago",10/20/22 0:23,y87kyp
comment,isypo7o,,"And of course Grant Shapps is all too happy to board the sinking ship, thundering idiot that he is.",10/19/22 20:52,y87kyp
comment,iszh4md,,She found a reason to jump off the ship before it hits the iceberg,10/19/22 23:46,y87kyp
comment,isz5s9z,,One little know trick is to put AirTags on all your ministers.,10/19/22 22:35,y87kyp
comment,it1lfkf,,"yeah, Africa's a massive continent.  Not all black people are going to like each other.  I taught a class once with all black attendees, and some were from Somalia and others were from Ghana.  Well, it turned out that the Ghanan was a princess.  She had bodyguards and everything, they were in the class as students.  Meanwhile the Somali was a refugee.  

The fights were legendary.  Never physical, but the cutting jibes could disrupt the class for 15 minutes.  I'm white.  I was pretty much ignored on everything once these ""negative discourses"" began.",10/20/22 10:46,y87kyp
comment,iszfm5x,,"""Chaos is a ladder""

•Littlefinger",10/19/22 23:37,y87kyp
comment,isypnfz,,The parallels to the US are striking.,10/19/22 20:52,y87kyp
comment,iszlf4l,,"4 PMs but how many elections?

Corbyn would've been massively preferrable to Boris or May, but he was completely fucked by Brexit in 2019: the average old school working class Labour voter voted for it, the younger left-wing element that made him leader voted against it; he tried to go down the middle and be ""neutral"" and that was never going to be a winning position when Boris was firmly taking a stance on advancing Brexit and parties like the Lib Dems were filling the vacuum to be the vote of opposition to Brexit.

Things are very different now. Even the right-wing media is now savaging this inept government for what an utter shower of shit they are. Labour winning the next election is as close to a sure thing as any election could be this far out.",10/20/22 0:14,y87kyp
comment,it0ffqh,,At least ours can’t keep a leader for more than a few months even when out of power.,10/20/22 3:53,y87kyp
comment,it1atae,,Time to force independence,10/20/22 8:23,y87kyp
comment,it1s54m,,It's a very similar experience for most English people. Unless you live in a key marginal your vote means effectively nothing and a lot of us didn't vote for the Tories or Brexit either. FPTP is a derelict excuse for an electoral system.,10/20/22 12:27,y87kyp
comment,it0bvrw,,The question really is will the Imperial Truss equal four or five Metric Mooches,10/20/22 3:26,y87kyp
comment,iszlurp,,"**IF** she reaches January she will pass the 119 mark, February the 144 mark.",10/20/22 0:17,y87kyp
comment,it25nfj,,"This is why I think a lot of the US's race politics is quite odd. It makes sense historically as many people literally cannot trace their lineage past slavery and so the Black/African American community sorta came together as one.

On the other hand, Africa is a continent of 1.2 billion people (that was in 2016, it's probably closer to 1.5 billion now). East and West Africa are very different, as is North and Sub-Saharan Africa. That's just broad regional differences, not even going into the differences within, for example, East Africa itself between Somalis, Kenyans, Ethiopians etc.

In the UK we *normally* base discussions surrounding racism and xenophobia, as well as *pride* based off of race or origin, on the specific culture they come from rather than simply skin colour.

Because there are probably greater differences between a Somali person and a Senegalese person, than between a Frenchman and a Hungarian.",10/20/22 15:07,y87kyp
comment,it2djsz,,Ghana is a republic though?...,10/20/22 16:13,y87kyp
comment,isypy4c,,Indeed but unfortunately for us in the UK we are not only ran be absolute idiots they have destroyed the economy already.,10/19/22 20:54,y87kyp
comment,it1ipck,,"If there was an election today, the Conservatives would go from an 80 seat majority to having only 22 mps, leaving them as one of the smallest parties and not even the biggest opposition party. I think we’ve got the message.",10/20/22 10:06,y87kyp
comment,itazio0,,"It was a tribal thing, within the nation.  She was wealthy.",10/22/22 9:54,y87kyp
post,y7v9zy,UK's Liz Truss admits mistakes as Conservative Party members call for her ouster,,10/19/22 9:45,
comment,iswpo2h,,"As an outsider to UK politics, is it legit possible she is already done?  She has barely been in her job 2 months.",10/19/22 9:57,y7v9zy
comment,iswp9gy,,I looked at OP's user and wondered 'is this Liz herself' ?,10/19/22 9:51,y7v9zy
comment,iswsve2,,Looks like the lettuce is going to win the race.,10/19/22 10:43,y7v9zy
comment,isxpo1e,,Are all right wing politicians bunch of scums? All bout lining their and corp pockets but the general population we just get a massive fuck you,10/19/22 16:51,y7v9zy
comment,iswqskn,,Wait... Wasn't she just appointed two months ago?,10/19/22 10:12,y7v9zy
comment,iswyk1u,,It's actually pretty impressive to face ousting so quickly. She on a speedrun,10/19/22 12:08,y7v9zy
comment,iswrf58,,Conservative right-wingers in no country are good at governing. They have no interest in governing. They only have an interest in making money for corporations.,10/19/22 10:21,y7v9zy
comment,iswwff5,,Just call a bloody election already.,10/19/22 11:36,y7v9zy
comment,iswp540,,The UK are gearing up to overtake Australia in having the most amount of PMs in the shortest period of time. Good job.,10/19/22 9:49,y7v9zy
comment,isxga1e,,"For anyone who wants another laugh, read about Alberta's new premeir in Canada. She's basically had as many scandals hit her as truss, only she's a week into the job.",10/19/22 15:35,y7v9zy
comment,isx232y,,"Lol her party turned on her, she should probably do the same. Go with things the public wants and suddenly you're gonna be in the driver's seat again. Otherwise we're watching a crash in slow motion.",10/19/22 13:00,y7v9zy
comment,iswu0dy,,"Well, she did kill the Queen. (/s)",10/19/22 10:59,y7v9zy
comment,isx78nx,,"How about she goes and the people that decided to put her in charge go as well? I mean clearly their judgement is bad, they put her in charge.",10/19/22 14:05,y7v9zy
comment,isxew8r,,Tell me you've tried nothing and you're all out of ideas without using those words.,10/19/22 15:23,y7v9zy
comment,isy27y3,,"Dude Ive had to put fresh out of high school kids on corrective action plans for not stocking bread fast enough at 2am because they're on their probationary perood. Usually this means they will be losing their job unless something dramatic happens ASAP. 

I don't know what the fuck is going on over there but we wouldn't even have given these dumbfucks the chance to stock bread poorly, let alone let them inside of our store at 2am. 

These are world leaders. Not some kids having a good time smoking doobies and listening to music while they work inside of a Walmart for an overnighter. I'm disturbed.",10/19/22 18:19,y7v9zy
comment,iswqv5g,,Next kick all the conservatives out.,10/19/22 10:13,y7v9zy
comment,isxc94g,,"Maybe it's just be but the problem seems to happen enough, you'd think it's the party that's the issue and not the PM that's causing issues. /s

Change the corn at the top of a pile of shit to a fresh one and it's still a pile of shit.",10/19/22 14:58,y7v9zy
comment,isy228f,,"""I admitted my mistakes honey, what do you want more of me?""",10/19/22 18:18,y7v9zy
comment,isyq15q,,"I don't understand this sentence, missing background: ""the vast majority of the economic vision that won her support from tens of thousands of grassroots Conservative Party members now lies in tatters""

The grassroots members wanted unfunded lower taxes for the rich and increased spending?",10/19/22 20:54,y7v9zy
comment,isz1yuz,,"I suppose it's a good thing for the Tories that they're allowing fracking then, since they're done scraping the barrel and have started deep drilling to the earths core for their next candidate",10/19/22 22:11,y7v9zy
comment,isz2853,,Don't you think she looks tired?,10/19/22 22:13,y7v9zy
comment,iswr1rp,,"The UK literally decided it didn't want any more money and then refused money and then Truss said ""let's take some money boys"" and it's like...1) you don't have any money. You gave it all away for free and 2) you don't have any money. Did she really think stealing from the poor would be am option when her entire parties' campaign was to remove the poor",10/19/22 10:16,y7v9zy
comment,isxz6u4,,"It really has been a case of sacking Boris to get someone worse in, bring him back and say ""Not so bad after all, am I?""",10/19/22 17:58,y7v9zy
comment,isyeg2a,,"Anyone they replace her with will be even more corrupt, including Johnson. Just like with their US Republican twins, 50 years of dumbing down their voters, has also led to a severe dumbing down of their politicians.",10/19/22 19:39,y7v9zy
comment,isx5g0b,,"Hopefully she'd only have received ex-PM benefits (pension, security etc), if she had won a general election. 

Otherwise it's a bloody ridiculous waste of taxpayers money and they'll be queueing up for 'a go' before they're given a bloody nose at the next general election.",10/19/22 13:44,y7v9zy
comment,isx7d3f,,"As a non-Brit, what exactly did she do? I get that she proposed some tax cuts that the markets didn’t like but otherwise what else? Why were those proposals so unpopular? How did she ruin her tenure so quickly?",10/19/22 14:07,y7v9zy
comment,isxa5ph,,What happens if Truss just says no and doesn't resign? It's my understanding the Tories have no formal mechanism to remove her outside of asking nicely.,10/19/22 14:37,y7v9zy
comment,iswu53q,,being anti brexit is being against sovreign control over tariffs. after brexit passed the pound soared. right now global productivity is down. when the recession ends brexit will be good for the UK GDP.,10/19/22 11:01,y7v9zy
comment,isx8pry,,Laughing stock,10/19/22 14:22,y7v9zy
comment,iszlhd9,,Posted before the utter cluster fuck of tonight's fracking vote.,10/20/22 0:14,y7v9zy
comment,iswqha6,,"Also an outsider, but so far it seems like she's doing so manu u-turns in quick succession, already fired one of her ministers after throwing him under the bus, . ..
The queen dying a day after meeting her was already a dark omen",10/19/22 10:08,y7v9zy
comment,iswt34c,,"She is done in all but leaving the job, she took a huge shit on the economy in the first weeks of the job and made things infinitely worse. She will be gone before the end of the year if not month id bet.",10/19/22 10:46,y7v9zy
comment,iswz0mr,,"She cost rich people a lot of money and then U-turned on their tax cuts.

She's done it's just a matter of how long. She probably won't survive her next screw up.",10/19/22 12:15,y7v9zy
comment,iswtuz8,,"She was done before she even started.

Total lame duck put in place to cut taxes for the rich in the short term, then take the blame for the inevitable shitshow that the UK has become.

Tories are a blight on the country",10/19/22 10:57,y7v9zy
comment,isy6730,,"As a Brit I can say that she is absolutely finished. 

The Conservative party has basically self-destructed over the last 2 years. Currently voting intention polls have Labour (our second biggest party) winning >50% of the votes, with the Conservatives winning about 20%. Some polls have them doing so badly that they would lose the official Opposition title and instead being a 3rd or 4th place party. 

The Government is on its 4th Finance Minister in 4 months, it's 2nd Home Secretary this year. Has scrapped most of its 2019 election manifesto promises. Has axed pretty much all of the mini-budget. Is set to unveil another budget at the end of the month; will likely go down badly as well. 

Liz Truss' disapproval rating is at 77%. She's fucked",10/19/22 18:45,y7v9zy
comment,isx5yrv,,"> As an outsider to UK politics, is it legit possible she is already done?

Yes, and it's very probable

The bottom line (policy failures apart) is that she has the communication skills of a low intensity droning cement mixer, and the personal charisma of an unflushed toilet. That being so, she can't win an election and once the Tory party decides that's the case, they usually drop the dead donkey very quickly (unless they're so far into the cycle that they're tacitly surrendering). I'm not sure the 'fall guy' logic applies to Truss though. There is a difference between damage limitation (accepting defeat) and getting burned to a crisp (the trajectory she's on)

The problem the party has however is finding a replacement. They don't want another drawn out self-regarding 10 week tour of the regions whilst they shuffle the Titanic around the deck chairs again

Clearly Johnson wants back in, and that's problematic. Johnson's supporters (and there's plenty that exist) don't want Sunak as they see him as a back-stabbing traitor. So there is a potential clash here

After her hideous performance yesterday with that hysterical audition, it's perfectly obvious that the evil Suella Braverman fancies the job, so she needs putting back in her box and telling that she isn't to run.  

I'm sure the candidate they'd all rally around as being acceptable to all is Ben Wallace, but he's really a bit of a one trick pony. He's basically a former Scots Guardsman, who is clearly comfortable in the Defence portfolio. He's got very little background in economic management and that's where the focus needs to be. 

Wallace declined to run a few months ago, clearly foreseeing where the elephant traps were along the road, so I expect he's being heavily leaned upon to agree this time. If I had to guess, I suspect they'll succeed in persuading him to do so this time, and this could be the delay we're witnessing. 

Wallace would probably be the candidate Labour would fear most, but if he's to be inserted as PM it's likely to be a coronation and an uncontested appoitment. They could possibly set something up in a similar manner to the way that Andrea Leadsom, having gotten into the last two, she withdrew her nomination allowing for a swift coronation of Theresa May and so prevent the need to take it to their membership

I'm quite sure for all they're saying publicly, Labour would much rather keep Truss in post",10/19/22 13:50,y7v9zy
comment,isx2i3a,,She's done.,10/19/22 13:06,y7v9zy
comment,isx36vq,,She hit the ground from day one.,10/19/22 13:15,y7v9zy
comment,isy9smc,,It seems you’re [Team Lettuce](https://www.reuters.com/world/uk/can-liz-truss-outlast-lettuce-uk-tabloid-asks-twitter-post-2022-10-14/). (All the best people are.),10/19/22 19:09,y7v9zy
comment,isylwlg,,"Potentially. But the Conservative party themselves have to remove her. So she'll be sticking in power for now because she signed a devils bargain with Jeremy Hunt.  An old conservative politician from a different Conservative faction. 

She's basically a puppet now though.",10/19/22 20:28,y7v9zy
comment,isyveho,,"She's prime minister by name only at this point. Its very much suspected the real person calling the shots is the chancellor, Jeremy Cunt",10/19/22 21:29,y7v9zy
comment,iswv2d6,,"Honestly, it's on a knife edge. She could well be done - it's never a good sign when journalists are saying ""how long will she last"" and her own party has MPs calling for her to go. 

That said, she chose someone who is ideologically very different to herself to be her new Chancellor. Jeremy Hunt represents a more moderate wing of the party, and his new budget is a total to 180 to the platform she stood on. You could argue that he's the de facto Prime Minister now. This could be enough for her to continue to survive.",10/19/22 11:15,y7v9zy
comment,iswpikn,,"Shh. I want them retirement benefits mate.

Edit: [Liz Truss in line for £18,000 ‘golden goodbye’ if she is forced out](https://www.independent.co.uk/news/uk/politics/liz-truss-quit-resign-severence-pay-b2206156.html)

-With no time limit, so if she's chucked tomorrow, she goes home with £18,000 **($20,238.39)** for six weeks of total shit work.",10/19/22 9:54,y7v9zy
comment,isy48wl,,Yep!,10/19/22 18:32,y7v9zy
comment,isymm0r,,Yup thats capitalism for ya,10/19/22 20:32,y7v9zy
comment,iswt4t2,,"She already has a 9% approval rating with her constituents, and only 12% with conservatives. She's crashed and burned so fast, and I'm so for it.",10/19/22 10:46,y7v9zy
comment,isy2e6z,,"They live for two things: enriching their private school chums, and anally raping the poor.",10/19/22 18:20,y7v9zy
comment,isyqpsl,,They would rather watch the country burn than give up power.,10/19/22 20:59,y7v9zy
comment,isy1sim,,"She's a fucking nut job. 

Absolute embarrassment to Canada.",10/19/22 18:16,y7v9zy
comment,isysiw8,,Just look at the US with over 70m people voting for just that with Trump. Youd be amazed just how many people are willing to vote against their own interests. Right wingers and conservatives really have mastered the art of turning gullible people against their own interests,10/19/22 21:11,y7v9zy
comment,isy60tx,,Not quite. The tithes are grabbing whoever they can to fill the job to avoid having to go to a general election.,10/19/22 18:44,y7v9zy
comment,isx81ok,,"Mostly that during a cost of living crisis with almost everyone in the country struggling to afford rapidly rising bills she introduced a tax cut for the the rich, which not only is really offensive but also managed to crash the value of the pound making everyone even poorer.",10/19/22 14:15,y7v9zy
comment,isy4sz4,,"Tanked their economy and the pound. And I believe let energy costs rise to a high rate, and claim they didn’t.",10/19/22 18:36,y7v9zy
comment,isy4qwx,,"Not sure if you are joking, but a Prime Minister does nothing without the clear mandate and support from the party MP's. The majority of Parliament can choose another PM at any moment.",10/19/22 18:36,y7v9zy
comment,isy5230,,"You’re not living in the same reality as the rest of the world. The pound didn’t soar, trade came to a grinding halt and many brexitors appeared on r/LeopardsAteMyFace and continue to do so.",10/19/22 18:38,y7v9zy
comment,isynjog,,Doubling down on bullshit that has been proven wrong.  Nice!,10/19/22 20:38,y7v9zy
comment,iswqvps,,"Not just any minister, essentially the second in command. The guy in charge of the money.",10/19/22 10:13,y7v9zy
comment,isxsnc6,,The Queen saw her and died of cringe.,10/19/22 17:13,y7v9zy
comment,isydw9e,,The Queen fell into a coma just hours after a private meeting with Truss.,10/19/22 19:36,y7v9zy
comment,isxf646,,Lizzie knew what was up,10/19/22 15:26,y7v9zy
comment,isxclg4,,"The Queen dying is because the Queen was 96 and very old. It's not an omen, people die everyday. The truth is Liz Truss is a self serving incompetent moron whose agenda is to serve the ultra rich with a ridiculous ideology of trickle down economics as evidenced in the book Britannia Unchained which she co-authored.",10/19/22 15:01,y7v9zy
comment,isyhtsh,,"Probably won't survive....how the fuck is she allow to survive the first one?  Second one?  Oh but it's just one more, right? copium, the system is fucked",10/19/22 20:01,y7v9zy
comment,isykt2m,,">Liz Truss' disapproval rating is at 77%

Wasn't it around the -50% region just a week ago?",10/19/22 20:21,y7v9zy
comment,isxmbvh,,Why do they see Sunak as a backstabbing traitor? I haven’t been following British politics very closely recently.,10/19/22 16:25,y7v9zy
comment,iszxlsv,,"> Britain faces a simple and inescapable choice - stability and strong Government with me, or chaos with Ed Miliband:

David Cameron, May 4th, 2015",10/20/22 1:37,y7v9zy
comment,isx41c4,,"Hunt did so much damage to the NHS during his tenure as health secretary, not to mention dismantling the UK's pandemic response a few years prior to Covid. He markets himself as centrist but his actions are anything but.",10/19/22 13:26,y7v9zy
comment,isx2m28,,"He's ramping up the austerity, he's very right wing. Just less likely to scare the markets.",10/19/22 13:07,y7v9zy
