type,id,title,text,created,parent_id
comment,irkfc2h,,"> Or JRM

You're probably witnessing a government now that's being run by JRM. Notably he, and his ERG group backed her. She was a remainer, and Sunak a Brexiteer. Why then would they back her?

The most compelling answer to my mind at least is that they recognised she was mailable and there isn't a lot she wouldn't be prepared to do in order to have power. Sunak by contrast would likely be a lot more inclined to do what he thought the right thing was and would be much harder for JRM to run",10/9/22 1:54,xyyufn
comment,irjlsey,,That would raise their rating.,10/8/22 22:01,xyyufn
comment,irjyib4,,"Wait, really? 10 seats is basically disappearing. I knew the Tories were doing bad, but I expected them to get like 30% of the seats, not literally 10 out of 650.",10/8/22 23:43,xyyufn
comment,irjre98,,How will the Labour Party capitalize on this?,10/8/22 22:47,xyyufn
comment,irko8f3,,The largest election swing in UK history was the national govt. They won over 500 seats. This would be about the same if repeated.,10/9/22 3:06,xyyufn
comment,irm21qh,,"Not even 10, it's 3",10/9/22 11:23,xyyufn
comment,irmmiki,,"There is an amazing possibility here too.

For those not in the know (which is a lot of Brits too), there is a party called 'The co-operative party'. You've probably never heard of them. Why?

Well, they don't exist as a separate party and have an electoral pact with Labour where some MP's run as members of both parties.

https://en.wikipedia.org/wiki/Labour_and_Co-operative

> Candidates contest elections under an electoral alliance between the two parties, that was first agreed in 1927. This agreement recognises the independence of the two parties and commits them to not standing against each other in elections. **It also sets out the procedures for both parties to select joint candidates and interact at a local and national level.**

> There were **26 Labour and Co-operative Party MPs elected at the December 2019 election, making it the fourth largest political grouping in the House of Commons**, although Labour and Co-operative MPs are generally included in Labour totals.

While it would never happen because they wouldn't take the role, if the vote totals turn out as the polls say, and more than 60 Labour/Co-op MP's were elected (59 is the maximum for SNP which polls say would be the opposition), then it would mean that some MP's would jointly be part of the government (Labour) and the Opposition (Co-op)",10/9/22 15:46,xyyufn
comment,irkk4et,,"Memories of running barefoot naked through wheat fields, maybe it was Somerfields.",10/9/22 2:33,xyyufn
comment,irl61h8,,"except the crash in the pound more than wiped out that tax cut and the crash in the market wiped out a big chunk of their wealth.

and the EU looks much more stable now so there no longer outside investment to prop it back up.

the rich are pissed at her too.",10/9/22 5:32,xyyufn
comment,irk1wl4,,"2 weeks onto the job and she crashed the pound to its lowest levels in 40 years 

Thats one hell of a spectacular fuck up during the start of her leadership",10/9/22 0:08,xyyufn
comment,irkdcj0,,"> In fairness to you guys though once a person is president, theres pretty much no way of kicking them out early (theres impeachment obvi but that’s very rare and failed twice for Trump) in the UK and other countries which use the parliamentary system, there are quite a few ways to boot PMs, potentially even triggering a whole election if its a minority government who loses to a vote of no confidence. 

I mean for a VONC to pass, at least 40 Tory MPs would need to support it, what Tory MP is going to vote to end their own career (given polling suggests a total wipeout currently).",10/9/22 1:38,xyyufn
comment,irl020l,,Don’t kid yourself about impeachment either. Donald Trump has proven it's mostly an impotent tool for removal.,10/9/22 4:42,xyyufn
comment,irl5o0j,,"heres a TIL from a few days ago, in the UK money Bills arent automatic confidence votes.

she can lose a Budget vote without triggering an election.",10/9/22 5:29,xyyufn
comment,irnmte4,,"Which half?   


His only working appearances that I can recall are  at the rallies of the Disinformed...and even those are stuffed with flapdoodle and nonsense.",10/9/22 20:15,xyyufn
comment,irki0w8,,I normally admire parliamentary systems as the 'compromises' needed to build ruling coalitions happen in daylight and can be withdrawn!  In the U.S. our consent with the parties plank is presumed but the leadership can turn on a dime and set new standards without any cost until they are primaried....and then something like Truss' election happens!  What the world doesn't work like 'Borgen'!?,10/9/22 2:16,xyyufn
comment,irm7b28,,"Conservatives are so much worse though, its like a house fire vs a forest fire of fucking over the poor.",10/9/22 12:37,xyyufn
comment,irk3re0,,"""why do we import so much cheese!?""


""Because we import it from countries that famously make great cheese you dumb fuck!""",10/9/22 0:23,xyyufn
comment,irl0hu4,,every country does. bc humans are fundamentally mostly follower morons,10/9/22 4:46,xyyufn
comment,iro7r0z,,The *English aint it?,10/9/22 22:31,xyyufn
comment,irkqce1,,You joke (I suspect) but I have a theory that the tory members which voted Truss in have planned for this all along and there will be yet another leadership contest in which Boris can participate.,10/9/22 3:23,xyyufn
comment,irjk8th,,Would probably run a more competent government too.,10/8/22 21:48,xyyufn
comment,irjohdq,,"You know... I'd argue against that statement. Sure, as the audience, we enjoy watching him. But in the world of Mr bean, no one likes him and clearly everyone finds him obnoxious. We live in the world with these politicians, we aren't an unaffected audience.",10/8/22 22:23,xyyufn
comment,irmds1w,,"Exactly, cutting the top rate of tax by 5% doesn't make up for a 20% drop in Sterling. 

The wealthy get paid little each year that gets taxed, the majority is held in assets which all dropped in value. It's the equivalent of a normal homeowner getting an extra £5 a week and the house value halving.",10/9/22 14:09,xyyufn
comment,irl7zi0,,that was them forcing her to. that budget did their wealth real harm.,10/9/22 5:48,xyyufn
comment,irjpxjq,,and neither of those things have happened because of the tories.,10/8/22 22:35,xyyufn
comment,irjkuee,,"Damn, how's that affecting your electricity bills? Must be pretty low right?",10/8/22 21:53,xyyufn
comment,irjn6dd,,"Conservatives, taking credit for things socialists put in place after fighting their implementation.


Since pretty much forever

https://en.m.wikipedia.org/wiki/Renewable_Energy_Directive_(EU)",10/8/22 22:12,xyyufn
comment,irjjmd4,,"UNICEF visited the UK to feed hungry children. THE UNITED KINGDOM!

12 years of Tory rule got the UK there. Are they winning yet?",10/8/22 21:43,xyyufn
comment,irjkqzb,,A world leader in nuclear power innovation and yet no new reactors have actually been built?,10/8/22 21:52,xyyufn
comment,irkdcpe,,"Haha, you really think all that came from the conservatives!?",10/9/22 1:38,xyyufn
comment,irjq0da,,"And our NHS is fucked, Brexit fucked everything, dentists don't exist anymore, billions and billions and billions of taxpayer money wasted, relations with Europe fucked, the channel migrant nonsense, every one is on fucking strike, no police, prisons full, courts full, knife crime on the rise, shortages everywhere, everyone is poorer.

You're the fucking blind one.",10/8/22 22:36,xyyufn
comment,irjk9ro,,Liberals haven’t been in power for 12 years ye muppet,10/8/22 21:48,xyyufn
comment,irjkb9i,,"No it’s not. FFS get a grip.

You Tory supporters suffer from Stockholm syndrome. They have destroyed the country over the last 13 years and you try to suck them off even more.

Beyond delusional.",10/8/22 21:49,xyyufn
comment,irl8yad,,"as bad as that would be, I must admit theres a dark spot in me that would enjoy watching that from afar.",10/9/22 5:57,xyyufn
comment,irme1sx,,"I guess thats fair. 

Every country has that certain percentage of people shoving Ken-dolls up to their butt and stabbing people for the lols.",10/9/22 14:12,xyyufn
comment,irksbk4,,"There is a chance of 100% that you are more informed about British political landscape than me.

That is why i ask, ""Why Do You Keep Hitting Yourself?""",10/9/22 3:39,xyyufn
comment,irm6u1q,,"I'll give you intelligent, no deal on courageous. 

She was ideologically driven, and smart to boot. 
Which resulted in the decimation of british industry, rioting and decades of underinvestment in anything north of the M4. 

None of that screams 'courageous' to me.",10/9/22 12:30,xyyufn
comment,irlewfm,,Thatcher was the most evil woman who has ever lived and you're the biggest idiot. Piss off,10/9/22 6:49,xyyufn
comment,irn6jri,,"I actually have! -01 or -02 i think.

On the train, watching those highrise dystopic apartments with all the clothes strung up to dry. Then me, thought that you would sort this shit out. Scenery was exactly what was seen in Clockwork Orange.

But you did not sort it out. And no attempts to sort shit out is done.",10/9/22 18:26,xyyufn
comment,irl8np6,,"As a Canadian, patriating is a good move. I hope you join us.",10/9/22 5:54,xyyufn
comment,irmdprk,,What a way to leave the entire Conservative party off the hook there..,10/9/22 14:08,xyyufn
comment,irjznj7,,"Exactly, Truss told the conservative party voters what they wanted to hear: That things would be ok, that the privileges and advantages they enjoy wouldn't be touched and that poor people would pay for it.

Sunak's plans sort of had rich people paying for it which they didn't like.

People are absolutely seeing through this government though, they know we are heading into a recession, they know the next election is unwinnable. So why not advantage yourself for 2 years until getting kicked out and Labour has to deal with the consequences of your actions.",10/8/22 23:51,xyyufn
comment,irkdomh,,"To emphasise how much she truly believes in her policies, in her very first meeting with Biden [she tried to convince him to follow her insane economic plan](https://www.theguardian.com/politics/2022/sep/20/liz-truss-urges-world-leaders-to-follow-uk-with-trickle-down-economics)",10/9/22 1:41,xyyufn
comment,irjme2z,,"Boris II: The Reckoning

That or “judgement day” but I can’t decide which is better",10/8/22 22:06,xyyufn
comment,irjphzc,,"Redditor resist channeling inner incel energy challenge, impossible difficulty",10/8/22 22:31,xyyufn
comment,irjr8yz,,"shes getting met with bile and hatred because she crashed the economy, is trying to introduce radical policies that werent in any manifesto and that no one wants, and so far seems to be a grossly incompetent ideologue who *overtly* favours the very rich at the direct and immediate expense of the poor. i put it to you that its no coincidence shes hated because of her policy, not her gender.",10/8/22 22:46,xyyufn
comment,irkdzys,,"> This is exactly what happened to Theresa May, too.

Theresa May was basically treated as an untouchable goddess who right-wing press heralded as the next coming of Thatcher when she was first appointed. It was only when she performed so badly in the 2017 election that she managed to lose a majority against Jeremy Corbyn that she started getting critciised.",10/9/22 1:43,xyyufn
comment,irjpk12,,"lol, she's literally almost collapsed the fucking economy!

But no - it's the sexism??

Ok, can you show 5 examples of bile and hatred Theresa May received from the press in her first month in office?",10/8/22 22:32,xyyufn
comment,irjtqqq,,And then he lost all his support.,10/8/22 23:06,xyyufn
comment,irmdwne,,"Yeah, lets not kid ourselves, the dumb British populace loooved Boris.",10/9/22 14:10,xyyufn
comment,irkfuf9,,Technically speaking (unless they die in office) I think they all resign?,10/9/22 1:58,xyyufn
comment,irm8h3p,,I suspect that Sunak's 'complexion' didn't endear him to Conservative party members.,10/9/22 12:54,xyyufn
comment,irm7e15,,Thanks!,10/9/22 12:38,xyyufn
comment,irmh0gf,,"> article 5

5**0**? Article 5 is, like, NATO go boom boom pow...",10/9/22 14:48,xyyufn
comment,irlcohu,,Oh as a Canadian I understand that rank choice voting is needed. Conservatives love to say they won the popular vote but fail to realize 60+ % of the country voted for a sort of progressive party (Liberal or NDP). What I fail to understand is after so many scandals/terrible economic decisions that they still get any votes.,10/9/22 6:29,xyyufn
comment,irkrzj5,,"> she's actually significantly less competent than Palin 

There is no evidence to prove this is even possible.",10/9/22 3:36,xyyufn
comment,irk2afg,,"I know the way it is currently accepted, the monarch will not dissolve Parliament without a request from the Prime Minister or a VoNC, but reading up on it, it looks like the Monarch never gave up the dissolution power. So theoretically, could the King order new elections and a new Parliament? It would spark an enormous political crisis, and I doubt it will ever happen, but is it still legally possible?",10/9/22 0:11,xyyufn
comment,irk4ha1,,"Oh damn, the UK actually got rid of constituent-initiated recall votes.

What morons allowed *that* to happen?  That's one of the only ways you can keep your politicians somewhat in check, by always having the ability to recall and replace them, should enough voters support the idea.  And in 2015, the UK said ""Nah, people shouldn't be allowed to change their representatives unless the government says so"".",10/9/22 0:28,xyyufn
comment,irjmato,,"She doubled down on not reversing any tax cuts, then reversed the removal of the 45% tax rate for the highest earners and blamed it all on the Chancellor- that she appointed.",10/8/22 22:05,xyyufn
comment,irlf85h,,"How much did some rich cunt pay you to post this, or are you really this much of a wanker?",10/9/22 6:52,xyyufn
comment,irkj4pi,,"I give him high marks for his time as Chancellor of the Exchequer especially during COVIDl. His furlough scheme was on-point. Heck NY Times states ""As the coronavirus crisis gripped the country, Mr. Sunak, a former hedge fund manager, rolled out a series of aid packages for businesses and individuals that were widely applauded. Those moves, and his air of competence, quickly made him a popular face of the government response.""",10/9/22 2:25,xyyufn
comment,irkip2l,,"I'm not. I'm distressed for millions of UK residents that are seeing their pensions threatened, their mortgages up, and their standard of living decreased.  UK is a great country and will survive this. However, it sucks that the common man needs to take the hit.",10/9/22 2:21,xyyufn
comment,irlvece,,"Well if the Tories don't replace her, then hopefully she gets the boot from the public in the next election.  I'd say Liz seems to be 4 chips short of a happy meal, but after watching her speeches and hearing her first PMQs, I'm of the mind that she is missing the whole happy meal.",10/9/22 9:55,xyyufn
comment,irlh9nl,,Oh I know.  By they I meant the torries.,10/9/22 7:12,xyyufn
comment,irkfsxe,,"But he was entertaining, lizz is just as inept but not as entertaining",10/9/22 1:58,xyyufn
comment,irlexgv,,"He really, really wasn't. His government was extremely corrupt and authoritarian and very openly considered itself above the law and was taking steps to actually make itself above the law. He just wasn't all that ideologically conservative where it didn't benefit himself directly, and he was a strong enough leader that the ERG couldn't force him to enact their batshit crazy programs.

Truss either has to or she wants to do the ERG's bidding, and the current UK chaos is the result. It's worth noting that for all that the chaos is much more obvious now, nothing much in the UK has actually changed since Truss took power. The UK was already on track for a protracted recession, energy bills were sky-high and getting higher, and social services were already a hollowed-out husk. I'll grant you that Johnson would probably have delivered better policies than Truss since his focus was always on popularity with the electorate rather than pushing ideology (as it should be), and a lot of people will be getting nostalgic for Johnson right about now, but that shouldn't be mistaken for either competence or fitness to lead.",10/9/22 6:49,xyyufn
comment,irncr63,,,10/9/22 19:08,xyyufn
comment,irjm8gh,,And it has been stated that they can arbitrarily change that rule,10/8/22 22:04,xyyufn
comment,irjomei,,"Oh, interesting. Thank you for that correction.",10/8/22 22:24,xyyufn
comment,irjqwcb,,"Basic explanation:

There's a group within the Conservative party (the 1922 committee) who set the internal rules for leadership elections, VoNC, etc. 

Under current rules/conventions, the 1922 committee can issue a VoNC if a 15% of currently sitting Tory MPs write a letter to the chairman of the 1922 committee expressing their loss in confidence in the leader. If that threshold is met, all currently sitting Tory MPs vote in a VoNC. If its decided that the party has no confidence in the leader, a new leadership election is held (from which the current leader is barred). If its decided that the party *does* have confidence in the leader, they're safe from another VoNC for a year. New leaders are given the benefit of being safe from a VoNC for a year, also.

It's important to note that the 1922 committee members can meet at any time to change the rules, if they wish.

May survived a VoNC, and the 1922 committee threatened to change the rules to allow another VoNC as her approval ratings continued to plummet and her government tied itself in loops and was unable to function. She resigned so that she didn't have to face the disgrace of a second VoNC.

Johnson survived a VoNC (by a finer margin than May). About a week later he was sort of ambushed by his cabinet (many of whom had only just assumed their posts) and asked to resign or they'd find another way to oust him. There were rumours at the time that Johnson agreed to resign, so that he could engineer a come back, as a resignation wouldn't bar him from running in a leadership election.

Truss technically has a year of safety, but the Tories and the 1922 committee in particular still managed to find a way to get rid of May and Johnson under similar circumstances.",10/8/22 22:43,xyyufn
comment,irjvgzr,,"You are right to. Someone has already explained the 1922 committee so I won't repeat. However, I would add that Boris' refusal to resign and his disregard for the ministerial code (not just with regards to himself but also with his cabinet) has lowered the standards and cast legitimacy on holding on until you are absolutely forced out (in his case the reignations of pretty much the entire government). At any other point prior to Johnson, this kind of situation would see the resignation of the Prime Minister. Now, amongst the plethora of things that urgently need fixing within the UK, the consitution itself is clearly one of them.",10/8/22 23:20,xyyufn
comment,irjtdj8,,"> Every time a Tory leader would lose a no confidence vote within the year they've resigned.

If they lose a non confidence, then they've lost! It's over, there and then

You mean every time they've won one?",10/8/22 23:03,xyyufn
comment,irjtzqv,,"No .... that just loses them their job. 

Occasionally you get conscientious renegades who change sides like Nick Boules, Alan Howarth, Emma Nicholson, Christian Wakeford etc but not on the scale necessray, and it doesn't follow they'll be given the Labour party nomination for the seat

MP's don't get paid a particularly large salary (America it ain't). British MP's don't have the same financial incentive hang on  which means that the likes Anna Soubry can earn more money as a barrister than an MP and so can follow her conscience when her party becomes too much for her",10/8/22 23:08,xyyufn
comment,irltys1,,New South Wales is even worse iirc.,10/9/22 9:37,xyyufn
comment,irkybp4,,"Cameron served 1 term, peaced out in his second.",10/9/22 4:28,xyyufn
comment,irm1h27,,Brown replaced Blair during a term. Brown never won an election.,10/9/22 11:16,xyyufn
comment,irma1bc,,Probably the 30 point polling lead for Labour,10/9/22 13:17,xyyufn
comment,irmf42y,,"Because ever since that election the Tories have made clear their arrogant contempt for all those who voted for them.  The public may be fools, but they don't like getting taken as fools.",10/9/22 14:26,xyyufn
comment,irmm82l,,"At the time, most of the country just wanted Brexit done and over with one way or the other. He was seen as the politician most likely to accomplish that, but now he (and the Tories in general) have very little to offer.",10/9/22 15:44,xyyufn
comment,irmzb1a,,"As other people have said, the previous election was all about Brexit.
The conservatives effectively read the public perception at the time, and ultimately was rewarded with a full majority to do what they felt was necessary.

This is the first time in quite a while where the party in power has had a clear majority, and this is then where the problems started, because the Tories have been constantly either inept, obviously corrupt, or just plain useless. Since they had a majority, there was no one else to blame this on.

As consequence the veil has kind of lifted, and it's become painfully clear how useless and corrupt the Tories are, and with Boris Johnson especially, how much contempt they view the public with. So now we're pretty much all pissed, and noone is happy with the Tory actions or policies.


In the abstract, it's all quite interesting. Following the results of the last election, we were all remarking about the Labour party receiving the worst result in an election in a generation, and remarking that the Tories might have solidified their rule for the next decade.
Now the positions have completely reversed.",10/9/22 17:33,xyyufn
comment,irngfqp,,Because the last time the polls gave Labour this much of a lead was 1997.,10/9/22 19:32,xyyufn
comment,iroauxs,,"Voters have found out that ""getting Brexit done"" wasn't perhaps the panacea they were hoping for (the slogan the Tories ran on last time), and Labour is a far more relevant-looking option to a lot of voters this time.",10/9/22 22:51,xyyufn
comment,irjyln8,,"I genuinely feel like we are seeing that happen worldwide. The smartest, more moderate people on the political right in each country are being pushed out and we as a collective are being left with the absolute morons and/or evil people. 

That's not going to end well for anyone.",10/8/22 23:43,xyyufn
comment,irjwzeb,,The bread and dripping of the Tory party…lovely.,10/8/22 23:31,xyyufn
comment,irm3ekt,,"They're not the dregs, they're the cream of the British Establishment (i.e. rich and thick).",10/9/22 11:41,xyyufn
comment,irl53y1,,Truss was against Brexit.,10/9/22 5:25,xyyufn
comment,irk8k8h,,How BoJo won the last election is still a mystery to me.,10/9/22 1:00,xyyufn
comment,irlpj0u,,"I personally think this shows a flaw in parliamentary system in general. The voters don’t really have a say on who gets to lead other than the party. It means being a PM is more about sucking up to your party than the voters. (Not saying the presidential system, especially the one in US, is perfect)",10/9/22 8:43,xyyufn
comment,irlut2c,,"Tom Tugendhat seemed to be pretty normal. But he was eliminated pretty early despite good debate performances.

What was up with that?",10/9/22 9:48,xyyufn
comment,irngium,,"She voted remain, amusingly.",10/9/22 19:33,xyyufn
comment,irm3iv9,,"Not sure i'd aggree.  


Boris was an idiot, but held back somewhat by his own extreme laziness.  


Truss is also an idiot and just as evil, but going full bore without any restraints.",10/9/22 11:43,xyyufn
comment,irpa403,,"Yeah, this is the real main difference. Both are governmentally incompetent, but you can be an absolute dumbass and still adored by the public if you know how to push their buttons. Media savvy and a cult of personality might get you a leadership position, but they don't mean you're *good* at being a leader.",10/10/22 3:12,xyyufn
comment,irm4hhv,,"> had similar levels was Thatcher

Thatcher was clever and had a consistent world view.  It was just that it was about fucking over poor people for the benefit of the few and destroying any sort of social cohesion.

Cameron was just an addicted gambler and lost our country to the roll of a die.",10/9/22 11:56,xyyufn
comment,irm6uxj,,"To be honest I wouldn't presume the relationship between Labour and SNP will be cordial like that. The SNP's mission statement is Scottish independence at any cost - the enemy is the British government. If Labour become government, expect to see the SNP attack Labour at every turn.",10/9/22 12:31,xyyufn
comment,irjvzj4,,"There is a phrase ""barking mad"" to mean someone who is desirously unhinged, often shortened to just 'barking'

Barking is also a place, a district of east London (outer). 

Dagenham is a bit further to the east

Dagenham is two railway stations (two stops) away from Barking

Edit - Dagenham not Dartford",10/8/22 23:23,xyyufn
comment,irjtv9v,,Gotta wonder how many good people have to be trampled in order for these sociopaths to crawl their way into power…,10/8/22 23:07,xyyufn
